codigo,descricao
0,SEM CONTRATO
20000018,"Locação de imóvel localizado na Avenida Piauí, nº 673, bairro Pacoval para funcionamento do Centro de Saúde do CBMAP."
20000021,CONTRATAÇÃO DE SERVIÇOS ON LINE
20000027,"LOCAÇÃO DE 1 (UM) IMÓVEL SITUADO NA AVENIDA PRESIDENTE VARGAS, Nº. 1748-B, C e D, BAIRRO CENTRAL PARA INSTALAÇÃO DO DIRETORIA DE SEGURANÇA CONTRA INCÊNDIO E PÂNICO-CBMAP."
20000028,Prestação de Serviço de Limpeza e Conservação
20000029,"LOCAÇÃO DE 01 (UM) IMÓVEL SITUADO NA AVENIDA 08 DE SETEMBRO, Nº 503, BAIRRO CIDADE LIVRE - VITÓRIA DO JARI, COM O OBJETIVO DE INSTALAR O 8º GRUPAMENTO DO CORPO DE BOMBEIROS MILITAR DO ESTADO DO AMAPÁ- 8º GBM/CBMAP."
20000040,"LOCAÇÃO DE VEÍCULOS AUTOMOTORES, CATEGORIAS DIVERSAS, CARACTERIZADOS E DESCARACTERIZADOS (SEM MOTORISTA E SEM COMBUSTÍVEL)"
20000043,PRESTAÇÃO DE SERVIÇOS DE MANUTENÇÃO PREVENTIVA E CORRETIVA PARA A FROTA OFICIAL DE MOTOCICLETAS DA POLÍCIA MILITAR DO ESTADO DO AMAPÁ- PMAP
20000045,"PRESTAÇÃO DE SERVIÇOS DE LIMPEZA, CONSERVAÇÃO E JARDINAGEM NAS DEPENDÊNCIAS DA POLÍCIA MILITAR DO AMAPÁ"
20000080,"CONCLUSAO DA CONSTRUÇÃO DE 160 UNIDADES HABITACIONAIS COM SANEAMENTO INTEGRADO DO PAC CONGOS, BAIRRO CONGOS, MUNICIPIO DE MACAPÁ"
20000107,Contratação futura de empresa especializado para prestação de serviços técnicos de implantação se software de gestão publica 
20000113,LOCAÇÃO DE 01 (UM) IMÓVEL
20000123,"CONCLUSAO DAS OBRAS DE 272 UNIDADES HABITACIONAIS COM SANEAMENTO INTEGRADO DO PAC ATURIA E 240 UNIDADES HAB. NO FNHIS/ATUARIA-,MACAPA"
20000127,CONTRATAÇÃO DE EMPRESA PARA EFETUAR SERVIÇOS DE MANUT. PREDIAL PREVENTIVA E CORRETIVA
20000132,Federalização da CEA
20000133,Renegociação de dívidas - BANAP 
20000134,Banco Nacional de Desenvolvimento Econômico e Social - PROINVEST
20000136,Banco Nacional de Desenvolvimento Econômico e Social - PDRI
20000138,Parcelamento previdenciário - MP 778/17 PREM
20000140,Parcelamento previdenciário - SEGURADO
20000151,CONTRATAÇÃO DE REDE DE IP MULTI-SERVIÇOS DE INTERNET.
20000228,manutenção e conservação de veículos automotores
20000242,"SERVIÇOS DE MANUTENÇÃO PREDIALPREVENTIVA E CORRETIVA, COM FORNECIMENTO DE MATERIAL E MÃO DE OBRA."
21000009,"Constitui objeto do presente Pregão a CONTRATAÇÃO DE PESSOA JURÍDICA para pro-vimento de Serviço de Internet para o Tribunal de Justiça do Estado do Amapá, conforme quantitativo e especificações constantes no anexo I deste edital."
21000020,"O presente instrumento contratual tem por objeto a locação de 2 (dois) pavimentos do ?EDIFICIO FECOMÉRCIO?, localizado à Av. Procópio Rola (cruzamento com a Rua Eliezer Levy),nº 261, Centro, Macapá/AP,CEP: 68.900-081, com finalidade de abrigar a Escola Judicial do Amapá - EJAP, o Departamento Administrativo do Tribunal de Justiça do Estado do Amapá, e os Juizados Virtuais Especiais do Tribunal de Justiça do Estado do Amapá. "
21000026,"O presente instrumento tem por objeto a contratação de produtos e serviços por meio de Pacote de Serviços dos CORREIOS, na categoria Platinum 1, mediante adesão ao Termo de Condições Comerciais e Anexos;"
21000039,"2.1. O presente Contrato tem por objeto a contratação de empresa especializada no fornecimento de rede IP MULTISERVIÇOS, a fim de atender as necessidades deste Tribunal de Justiça do Estado do Amapá. 2.2. O regime de execução do objeto deste Contrato será de empreitada por preço unitário."
21000070,EMPRESA ESPECIALIZADA EM SERVIÇOS DE VIGILANCIA PATRIMONIAL
21000080,"Constitui objeto do presente instrumento a Contratação de serviços de manutenções preventivas e corretivas, bem como instalação e desinstalação de equipamentos de refrigeração, incluindo o fornecimento de peças e acessórios."
21000082,"SERVIÇOS DE FOTOCÓPIAS, IMPRESSÃO E ENCADERNAÇÃO."
21000084,Serviço Contínuo de Manutenção em Aeronave - Asa Fixa
21000085,SERVIÇO DE LOCAÇÃO IMÓVEL
21000095,COMPUSERVICE TDA
21000097,Serviço de formação de condutores com adição de categorias de CNH para militares condutores de veículos de emergência.
21000098,MARCO ZERO SERVIÇOS LTDA
21000101,IUANNE MARY CASTILLO
21000105,SEARCH INFORMATICA LTDA
21000108,ICE CARTÕES ESPECIAIS LTDA
21000123,"COLETA, TRANSPORTE, TRATAMENTO E DISPOSIÇÃO DE RESIDUOS SOLIDOS"
21000131,"O objeto do presente instrumento é a Contratação de empresa especializada na prestação de serviços continuados, sem locação de mão de obra, de monitoramento e rastreamento veicular via satélite por GPS/GSM/GPRS, compreendendo a instalação de módulos rastreadores em comodato, disponibilização e licença de software de gerenciamento com acesso via Web e os respectivos serviços de instalação, configuração, capacitação, suporte técnico e garantia de funcionamento para gestão de frota do Tribunal de Justiça do Amapá, que serão prestados nas condições estabelecidas no Termo de Referência, anexo do Edital."
21000133,CORREIOS E TELEGRAFOS - ECT.
21000137,prestação de serviços de Outsourcing de Impressão 
21000170,Locação de 01 (um) imóvel para fins de instalação do anexo da Defensoria Pública do Estado do Amapá.
21000172,PRESTAÇAO DE SERVIÇOS TÉCNICOS E ELABORAÇÃO DE PROJETOS
21000181,PRESTAÇÃO DE SERVIÇOS CONTINUADOS DE MANUTENÇÃO E CONSERVAÇÃO DE VEÍCULOS AUTOMOTORES.
21000206,Parcelamento Previdenciário - Segurado GEA
21000207,Parcelamento Previdenciário - Segurado SESA
21000208,Parcelamento Previdenciário - Segurado SEED
21000225,"O presente Contrato tem por objeto a contratação de empresa de Tecnologia da Informação para prestação de serviços continuados de tecnologia da informação voltada ao desenvolvimento e manutenção evolutiva e adaptativa do sistema de gestão judicial deste Tribunal, em regime de Fábrica de Software de forma remota e presencial, de acordo com os padrões de desempenho e qualidade correspondentes à especialização exigida para o atendimento das demandas relacionadas à evolução da implantação do Processo Judicial Eletrônico - PJe no Tribunal de Justiça do Estado do Amapá."
21000236,Contratação de empresa especializada na prestação de serviços em hospedagem de site e serviços de e-mails. 
21000238,"CONTRATAÇÃO DE EMPRESA DE INSTALAÇÃO ,DESINSTALAÇÃO , MANUTENÇÃO PREVENTIVA E CORRETIVA DE CONDICIONADORES DE AR E EQUIPAMENTOS DE REFRIGERAÇÃO"
21000248,contratação de empresa para prestação de serviços continuados de exames laboratoriais de rotina e especializados (microbiológicos).
21000249,contratação de empresa para prestação de serviços continuados de exames laboratoriais de rotina e especializados.
21000280,TICK SOLUÇÕES HDFGT S.A
21000290,FORNECIMENTO DE COMBUSTÍVEL AERONÁUTICO
21000291,Parcelamento Não Previdenciário - PGFN - 5107028
21000293,Parcelamento previdenciário Nº 640300294 - PATRONAL
21000294,Parcelamento previdenciário Nº 640300839 - SEGURADO
21000297,CONTRATAÇÃO DE INSTITUIÇÃO PARA OPERAR SERVIÇOS E GERENCIAMENTO DE MOVIMENTAÇÃO FINANCEIRA 
21000300,"SERVIÇOS DE LIMPEZA E CONSERVAÇÃO, COM O FORNECIMENTO DE INSUMOS E MATERIAIS "
21000304,"PRESTAÇÃO DE SERVIÇOS DE INSTALAÇÃO, DESINSTALAÇÃO, MANUTENÇÃO PREVENTIVA E CORRETIVA DE CONDICIONADORES DE AR E EQUIPAMENTOS DE REFRIGERAÇÃO, COM REPOSIÇÃO DE PEÇAS, COMPONENTES E ACESSÓRIOS"
21000316,Contratação de empresa especializada na prestação de serviços de Outsourcing de impressão
21000343,"Contratação de empresa para a prestação de Serviços de Apoio Técnico Especializado (Eletricista I, Eletricista II, Eletricista III, Auxiliar de Almoxarife I, Auxiliar de Manutenção Predial, Técnico em Telecomunicações e Piloto Fluvial), que serão prestados de forma continuada, mediante locação de mão-de-obra e executados no regime de empreitada por preço global, por lote."
21000351,"SERVIÇOS DE URBANIZAÇÃO DO 4º BATALHÃO DA POLICIA MILITAR, NO MUNICÍPIO DE STN/AP"
21000374,MANUTENÇÃO DE CONDICIONADORES DE AR
21000380,LOCAÇÃO DE IMÓVEL
21000381,CONTRATAÇÃO DE EMPRESA ESPECIALIZADA EM SERVIÇOS DE LIMPEZA E CONSERVAÇÃO
21000390,PRESTAÇÃO DE SERVIÇO DE LOCAÇÃO. DIGIMAC INFORMATICA LTDA - EPP
21000394,"CONTRATAÇÃO DE SERVIÇO DE MANUTENÇÃO NA AERONAVE HELICÓPTERO ESQUILO AS350-B2, PREFIXO PR-GAP, PERTENCENTE AO GTA/SEJUSP/AP, INCLUINDO: APOIO TÉCNICOOPERACIONAL, CONTROLE TÉCNICO, SERVIÇOS DE MANUTENÇÃO PREVENTIVA E CORRETIVA,PROGRAMADOS E NÃO PROGRAMADOS."
21000399,Aluguel de prédio no municípi de Laranjal do Jari
21000400,CONTRATAÇÃO DE EMPRESA PARA CESSÃO DE EQUIPAMENTOS EM REGIME DE COMODATO COM FORNECIMENTO E AQUISIÇÃO DE INSUMOS LABORATORIAIS PARA ATENDER AS NECESSIDADES DE REALIZAÇÃO DE TESTES IMUNO-HEMATOLÓGICOS
22000003,"PRESTAÇÃO DE SERVIÇOS DE LOCAÇÃO DE VEÍCULOS (PICK-UP), SEM MOTORISTA, SEM COBUSTÍVEL, QUILOMETRAGEM LIVRE, COM SEGURO TOTAL, MANUTENÇÃO PREVENTIVA E CORRETIVA."
22000004,"PRESTAÇÃO DE SERVIÇOS LOCAÇÃO DE VEÍCULOS AUTOMOTORES (TIPO SEDAN), SEM MOTORISTA, SEM COMBUSTÍVEL, QUILOMETRAGEM LIVRE, COM SEGURO TOTAL, MANUTENÇÃO PREVENTIVA E CORRETIVA"
22000005,PRESTAÇÃO DE SERVIÇOS DE BUFFET
22000006,SERVIÇO DE AGENCIAMENTO DE VIAGENS
22000008,"PRESTAÇÃO DE SERVIÇOS DE INSTALAÇÃO, DESINSTALAÇÃO, MANUTENÇÃO PREVENTIVA E CORRETIVA DE CONDICIONADORES DE AR E EQUIPAMENTOS DE REFRIGERAÇÃO, COM REPOSIÇÃO DE PEÇAS, COMPONENTES E ACESSÓRIOS"
22000018,CONTRATAÇÃO DE EMPRESA ESPECIALIZADA EM SERVIÇO DE LIMPEZA E CONSERVAÇÃO NAS UNIDADES DA DPE-AP
22000021,"O objeto do presente Termo de Contrato é a contratação de instituição sem fins lucrativos dedicada à recuperação social de pessoas condenadas a penas privativas de liberdade que cumprem pena em regime semiaberto, aberto e egressos do sistema prisional local, por meio de capacitação laboral, como forma de retorno da cidadania, ora suspensa. "
22000035,OUTSOURCING DE IMPRESSÃO
22000042,"Constitui objeto da presente contratação a aquisição do serviço PROID ? Identidade digital do servidor, serviços estes detalhados no Anexo 1 ? Descrição dos Serviços, deste contrato."
22000060,"O presente contrato tem por objeto Prestação de Serviços de Limpeza, Conservação e Higienização, Copeiro, Jardineiro, Encarregado e Carregador, compreendendo o fornecimento de mão de obra e materiais como máquinas, equipamentos, ferramentas e utensílios necessários a execução do serviço, visando atender as necessidades dos órgãos e entidades da administração pública do Estado doAmapá., visando atender as necessidades do Instituto de hematologia e Hemoterapia do Amapá ? HEMOAP. "
22000066,"FÊNIX SERVIÇOS ESPECIALIZADOS EIRELI : CONTRATAÇÃO DE EMPRESA ESPECIALIZADA NOS SERVIÇOS DE LIMPEZA E CONSERVAÇÃO, COM FORNECIMENTO DE INSUMOS E MATERIAIS (UNIFORMES E EQUIPAMENTOS)"
22000070,"a Prestação de Serviços de Manutenção Preventiva e Corretiva nos Motores de Popa, Reboques de Embarcações e Embarcações em Alumínio"
22000071,PRESTAÇÃO DE SERVIÇOS DE MANUTENÇÃO DE CILINDROS DE EQUIPAMENTOS AUTONÔMOS DE PROTEÇÃO RESPIRATÓRIA
22000075,J. B. DA COSTA E CIA
22000087,"O presente contrato tem por objeto a CONTRATAÇÃO DE EMPRESA ESPECIALIZADA NO SERVIÇO CONTINUADO DE FORNECIMENTO DE ALIMENTAÇÃO (LANCHES PRONTOS E REFEIÇÃO), para atender as demandas do Instituto de Hematologia e Hemoterapia do Amapá ? HEMOA"
22000089,"Prestação de Serviços de em Intermediação de Fornecimento de Combustível mediante Sistema Informatizado com Utilização de Cartão Magnético com senha, para Gerenciamento do Abastecimento de Veículos, Embarcações, Maquinários, Equipamentos e outros serviços prestados por postos credenciados, visando atender as necessidades do Centro de Reabilitação do Estado do Amapá -CREAP. "
22000097,"prestação de serviços continuados de copeiragem, agente de portaria, atendente, jardineiro, piscineiro, com fornecimento de insumos e materiais (uniformes e equipamentos) a serem utilizados na execução dos serviços, visando atender as necessidades da Controladoria Geral do Estado do Amapá."
22000099,"CONCLUSÃO DA OBRA DE REFORMA E AMPLIAÇÃO DO HOSPITAL DA CRIANÇA E DO ADOLESCENTE, NO MINICÍPIO DE MACAPÁ"
22000101,"Contratação de empresa especializada para a prestação de serviço móvel pessoal (SMP), serviço de longa distância (LDN) e internacional (LDI)"
22000102,Contratação de Empresa Especializada na Prestação de Serviço de Recarga e Manutenção de Extintores
22000114,COMPANHIA DE ELETRICIDADE DO AMAPÁ - CEA EQUATORIAL.
22000115,"A contratação de serviço de solução corporativa de ferramenta colaborativa em nuvem, incluindo integração, migração e treinamento."
22000121,"Contratação de prestação de serviços continuados de Agente de Portaria e Atendentes, com fornecimento de insumos e matérias (uniformes e equipamentos), a serem utilizados na execução visando atender as necessidades dos órgãos e entidades da administração pública do Estado do Amapá, para atender as necessidades do Instituto de Hematologia e Hemoterapia do Amapá ? HEMOAP"
22000122,C. PEREIRA CARDOSO EIRELI
22000124,"PRESTAÇÃO DE SERVIÇOS CONTINUADOS , AGENTE DE PORTARIA, ATENDENTE..."
22000128,"AQUISIÇAO FERRAMENTA, BANCO DE PREÇOS"
22000130,"O presente Termo de Contrato tem por objeto a Contratação de empresa (pessoa jurídica) especializada na prestação de serviços de gerenciamento de frota, além de grupos geradores e motores de popa, abrangendo o fornecimento de combustíveis e manutenção automotiva e equipamentos em geral, por meio de sistema informatizado, com fornecimento de peças, componentes, acessórios entre outros materiais, inclusive, transporte em suspenso por guincho e socorro mecânico, produtos, serviços mecânicos de toda ordem, elétricos, lanternagem, pintura, lavagem, capotaria, troca e reparos de pneus, alinhamento, balanceamento, por meio de rede de oficinas e centros automotivos credenciados e disponibilizados, com implantação e operação de sistema informatizado e integrado de gestão de frota, para atender os veículos/equipamentos do TRIBUNAL DE JUSTIÇA DO AMAPÁ, conforme descrição e quantitativos especificados no ANEXO II do Termo de Referência."
22000134,Contratação de empresa especializada para prestação de serviço de operação de sistemas multimídia;
22000150,"O objeto do presente Termo de Contrato é a contratação de serviços, por intermédio de empresa especializada para fornecimento sob demanda de refeições tipo (café da manhã, almoço/jantar, lanche, coffee break e coquetel), doravante denominado refeições prontas, in natura e bebidas (não alcoólicas), nas quantidades anuais estimadas previstas na cláusula primeira."
22000170,"Prestação de Serviços Técnicos de instalação, implantação, integração, migração de dados, configuração, parametrização, treinamento, atualização de versão e Suporte Técnico e Cessão de Licença de Direito de Uso de uma solução Tecnológica Unificada de Gestão de Planejamento, Execução Orçamentária, Financeira, Patrimonial e Contábil que atenda as necessidades e especificidades do Governo do Estado do Amapá, incluídos todos seus poderes constituídos, integrando-se aos demais sistemas corporativos do Estado em total consonância com a legislação pertinente. Os serviços serão prestados nas condições estabelecidas no Projeto Básico, os quais integram este instrumento, independente da transcrição."
22000173,"SERVIÇOS DE MANUTENÇÃO PREVENTIVA E CORRETIVA, FORNECIMENTO DE PEÇAS E ASSISTÊNCIA TÉCNICA 24H PARA ELEVADORES"
22000182,"PRESTAÇÃO DE SERVIÇO TÉCNICO PARA REALIZAÇÃO DO CONTROLE DE VETORES E PRAGAS URBANAS ? DESINSETIZAÇÃO, DESRATIZAÇÃO, DESCUPINIZAÇÃO, CONTROLE DE MOSQUITOS E CONTROLE DE POMBOS/ MORCEGOS, COM FORNECIMENTO DE MÃO DE OBRA, INSUMOS, MATERIAIS, EQUIPAMENTOS E FERRAMENTAS NECESSÁRIOS À EXECUÇÃO DOS SERVIÇOS, NAS ÁREAS INTERNAS E EXTERNAS "
22000183,Aquisição de Aeronaves Remotamente Pilotadas ? RPA (Drones)
22000192,"2.2. Contratação de Empresa Especializada no Serviço de Coleta, Transporte, Tratamento e Destinação Final de Resíduos dos Grupos A, B, D e E, para atender as necessidades do Instituto de Hematologia e Hemoterapia do Amapá ? HEMOAP"
22000194,SERVIÇO ORGANIZAÇÃO DE EVENTOS
22000202,"OBRA DE CONSTRUÇÃO DA CASA DA MULHER BRASILEIRA, NO ESTADO DO AMAP'A"
22000225,Serviço de impressão de projetos arquitetônicos e complementares (plotagem)
22000229,PRESTAÇÃO DE SERVIÇOS DE LOCAÇÃO DE VEÍCULOS AUTOMOTORES TERRESTRES.
22000230,"CONTRATAÇÃO DE EMPRESA ESPECIALIZADA NA REALIZAÇÃO DE EXAMES LABORATORIAIS (SOROLOGIA) QUE UTILIZAM A METODOLOGIA DE QUIMILUMINESCÊNCIA OU ELETROQUIMILUMINESCÊNCIA NO LABORATÓRIO DO HEMOAP, COM FORNECIMENTO DE INSUMOS, REGANTES, CONSUMÍVEIS E CESSÃO DE EQUIPAMENTOS EM REGIME DE COMODATO, SEM ÔNUS, para atender as demandas do Instituto de Hematologia e Hemoterapia do Amapá ? HEMOAP"
22000255,CARDODO & SILVA CONSTRUÇÕES E SERVIÇOS LTDA - EPP
22000263,"O objeto do presente Termo de Contrato é a contratação de empresa para fornecimento de mão de obra especializada de Pessoa com Deficiência para a prestação de serviços de gestão documental, tratamento arquivístico e apoio administrativo nas áreas de ouvidoria e recepção/balcão virtual, compreendendo o fornecimento de toda a infraestrutura tecnológica necessária, como: softwares, scanners, computadores, servidores de armazenamento de imagens, servidor de processamento e reconhecimento ótico de caracteres (OCR), materiais de consumo, equipamentos de proteção individual (EPI) e demais equipamentos adequados/necessários à execução dos trabalhos. "
22000267,"Contratação de extensão de garantia para CHASSI HP BLADESYSTEM C7000, seus módulos, componentes e lâminas."
22000274,"SERVIÇO MÓVEL PESSOAL (SMP), FORNECIMENTO LINHAS E DADOS"
22000298,"PRESTAÇÃO DE SERVIÇOS DE INSTALAÇÃO, DESINSTALAÇÃO, MANUTENÇÃO PREVENTIVA E CORRETIVA DE CONDICIONADORES DE AR. "
22000304,ELEC INDUSTRIA E COMERCIO DE EQUIPAMENTOS LTDA
22000321,OBRA E SERVIÇOS DE ENGENHARIA PARA AMPLIAÇÃO DO HOSPITAL ESTADUAL DE OIAPOQUE-HEO.-AP/CONSTRUÇÃO DO CENTRO DE TRATAMENTO INTENSIVO.
22000327," locação de imóvel situado na Avenida Procópio Rola, nº: 500, bairro: Central, Macapá/AP, CEP: 68.900-000"
22000345,Orientação por escrito em licitações e contratos. Acesso anual Zênite Fácil.
22000368,O objeto do presente contrato é a contratação de empresa de telecomunicações para prestação de serviço de comunicação de dados por meio de link terrestre de dados dedicado via fibra óptica para interconexão entre a sede do TJAP (Macapá) e a Comarca de Oiapoque (LAN-TO-LAN);
22000370,"AMPLIAÇÃO E ADAPTAÇÃO, 2ª ETAPA, DO HOSPITAL REGIONAL DE PORTO GRANDE"
22000373,"CONSTRUÇÃO DO CENTRO DE APOIO AO TURISTA, EM FERREIRA GOMES."
22000383,ELABORAÇÃO DE PROJETOS
22000385,Parcelamento Previdenciário - Aditivo Segurado MILITAR
22000396,"O objeto do presente instrumento é a contratação de serviços de fornecimento, sob demanda, de refeições tipo (café da manhã, almoço/jantar, lanche, coffee break e coquetel), doravante denominado refeições prontas, in natura e bebidas (não alcoólicas), que serão prestados nas condições estabelecidas no Projeto básico, à Escola Judicial do Amapá."
22000397,"O objeto do presente instrumento é a contratação de serviços de fornecimento, sob demanda, de refeições tipo (café da manhã, almoço/jantar, lanche, coffee break e coquetel), doravante denominado refeições prontas, in natura e bebidas (não alcoólicas), que serão prestados nas condições estabelecidas no Projeto básico, ao Tribunal do Júri da Comarca de Macapá."
22000398,"O objeto do presente instrumento é a contratação de serviços de fornecimento, sob demanda, de refeições tipo (café da manhã, almoço/jantar, lanche, coffee break e coquetel), doravante denominado refeições prontas, in natura e bebidas (não alcoólicas), que serão prestados nas condições estabelecidas no Projeto básico, à Sede do TJAP."
22000402,Parcelamento previdenciário Nº 4328322/22
22000403,Parcelamento previdenciário Nº 642705097/22
22000404,REFINANCIAMENTO DE DÍVIDAS COM BASE NA LEI COMPLEMENTAR Nº 178/2021 - HONRAS DA UNIÃO
22000405,"Contratação de licenciamento da Plataforma Blip, destinada à construção, integração e evolução de contatos inteligentes (Chatbots) para atendimento e relacionamento com multiusuários, sendo a critério da CONTRATANTE a integração de aplicativos Web Chat(portal), Facebook Messenger, Facebook Workplace, WhatsApp Official Business API, Instagram, Microsoft Teams, Telegram, Google Business Message, com interação de aplicativos móveis Android e IOS"
22000416,"O objeto do presente instrumento é a contratação de serviços de fornecimento, sob demanda, de refeições tipo (café da manhã, almoço/jantar, lanche, coffee break e coquetel), doravante denominado refeições prontas, in natura e bebidas (não alcoólicas), que serão prestados nas condições estabelecidas no Projeto básico, ao Fundo de Apoio aos Juizados da Infância e Juventude (FAJIJ)."
22000420,Locação de imóvel para atender às necessidades do núcleo regional de Santana - DPE/AP
22000422,"Contratação de extensão de garantia para DATA CENTER MODULAR INDOOR, incluindo todos os sistemas e subsistemas e compõem a infraestrutura da solução."
22000433,AQUISIÇÃO DE CENTRAIS DE AR DE 18MIL E 24MIL BTUS.
22000435,Contratação de empresa especializada na prestação de serviços de fornecimento continuado de oxigênio medicinal
22000437,"Contratação de empresa especializada na prestação, de forma contínua, dos Serviços de Vigilância Patrimonial Armada, diurna e noturna,, mediante locação de mão de obra, a serem executados nas dependências dos prédios do Tribunal de Justiça do Amapá, na capital e nos interiores"
22000440,SERPRO - SERVIÇO FEDERAL DE PROCESSAMENTO DE DADOS.
22000441,Contratação de empresa especializada em prestação de serviços de seguro de vida em grupo de 65 estagiários para DPE/AP
22000454,Contratação de empresa de telecomunicações para prestação de serviços de comunicação de dados por meio de link terrestre de dados dedicado via fibra óptica para interconexão entre a sede do TJAP (Macapá) e a comarca de Vitória do Jari (LAN-TO-LAN).
22000462,"CONCLUSÃO DE 118 UNIDADES HABITACIONAIS NO BAIRRO DO CONGÔS, MUNICÍPIO DE MACAPÁ-AP"
22000469,"CONTRATAÇÃO DE EMPRESA PARA PRESTAÇÃO DE SERVIÇO CONTÍNUO, SEM DEDICAÇÃO EXCLUSIVA DE MÃO DE OBRA, PARA REALIZAÇÃO DE EXAMES (HEMATOLÓGICOS, BIOQUÍMICOS E DE COAGULAÇÃO) EM AMOSTRAS HUMANAS DO LABORATÓRIOS DE ANÁLISES CLÍNICAS, COM FORNECIMENTO DE INSUMOS E REAGENTES E CESSÃO DE EQUIPAMENTOS EM REGIME DE COMODATO."
22000485,"O presente instrumento tem por objeto a contratação de empresa especializada na prestação de SERVIÇOS de EXAMES LABORATORIAIS de DNA (ácido desoxirribonucléico), por empresa especializada, para atender as requisições nos Processos Judiciais de Investigação de Paternidade em tramitação nas Comarcas do Estado do Amapá, nas quantidades contidas na cláusula primeira. "
22000493,"O presente contrato tem por objeto a prestação dos serviços de organização e execução de eventos e serviços correlatos (decoração, sonorização, locação de tendas e espaço físico e outros), visando atender as necessidades do Tribunal de Justiça do Estado do Amapá."
22000504,AQUISIÇÃO DE MATERIAL DE EXPEDIENTE. 
22000505,AQUISIÇÃO DE ÁGUA MINERAL DE 20 LITROS
22000516,AQUISIÇÃO DE MICROCOMPUTADOR
22000538,CONTRATACAO DA PLATAFORMA DE SEGURANCA EM NUVEM GOVSHIELD - MODALIDADE OURO
22000552,SERVIÇO DE SEGURO TOTAL PARA OS VEÍCULOS DA DEFENSORIA PÚBLICA DO ESTADO DO AMAPÁ
22000555,MANUTENÇÃO SUSTENTAÇÃO DE SISTEMA SOFTWARE
22000556,"O presente instrumento contratual tem por objeto a contratação de pessoa jurídica especializada na prestação de serviços de condução de veículos, a fim de conduzir os veículos oficiais pertencentes à frota do Tribunal de Justiça Estado do Amapá, bem como daqueles eventualmente cedidos, requisitados ou locados, utilizados no deslocamento de autoridades e servidores, além do transporte de materiais e outros equipamentos."
22000557,OFICINA ORTOPÉDICA DO CENTRO DE REABILITAÇÃO DO AMAPÁ - CREAP
22000559,"AMPLIAÇÃO E ADAPTAÇÃO DA ESCOLA ESTADUAL DE TEMPO INTEGRAL, RAIMUNDA VIRGULINO, NO MUNICÍPIO DE MACAPÁ-AP"
22000560,"REFORMA E AMPLIAÇÃO DA ESCOLA ESTADUAL DOUTOR MURILO BRAGA, NO MUNICÍPIO DE MAZAGÃO/AP."
22000562,"REFORMA E AMPLIAÇÃO DA ESCOLA ESTADUAL CATARINA DANTAS TIBÚRCIO, NO MUNICÍPIO DE SANTANA / AP "
22000564,PARCELAMENTOS DE IRRF 
22000565,PARCELAMENTO PREVIDENCIÁRIO DO RPPS JUNTO AMPREV
22000567,CONTRATAÇÃO DE LINK DE INTERNET
23000001,"Contratação de empresa para fornecimento continuo de abastecimento de água potável, coleta e tratamento de esgoto sanitário."
23000002,"O objeto do presente contrato é a Contratação de Empresa Concessionária de Serviço Público para a prestação do serviço público de abastecimento de água e coleta de esgoto sanitário dos imóveis (economias) de responsabilidade do TJAP, conforme detalhamento presente no projeto básico e seus anexos."
23000022,CONTRATAÇÃO DE TELEFONIA MÓVEL
23000023,"Contratação de empresa para o fornecimento de forma continua de energia elétrica para atender as necessidades permanentes do prédio sede, núcleos regionais e futuras inclusões, alterações ou substituições"
