codigo,descricao
25001578,PROCESSO ADMINISTRATIVO VISANDO A CONTRATAÇÃO DE EMPRESA ESPECIALIZADA EM FORNECIMENTO DE SOLUÇÃO PARA CRIAÇÃO DE CENTRAL DE SUPORTE DE SERVIÇOS DE TI.
25001579,AQUISIÇÃO DE COMBUSTÍVEIS
25001580,AQUISIÇÃO DE EQUIPAMENTOS DE INFORMÁTICA PARA MODERNIZAÇÃO DO PARQUE TECNOLÓGICO DA SEPLAN
25001581,AQUISIÇÃO DE SEMIRREBOQUE 
25001582,Fornecimento de refeições para o Tribunal do Juri da Comarca de Macapá
25001583,"Aquisição de material permanente para estruturação do Plantão Social do Conjunto Habitacional Vila dos Oliveiras, relativos a execução do Projeto Técnico Social ? PTS"
25001584,"Aquisição de frigobares para atender as necessidades das delegacias da capital e do interior, assim como, as unidades administrativas."
25001587,"AQUISIÇÃO DE SOROS PARA A REALIZAÇÃO DE EXAMES IMUNOHEMATOLÓGICOS, VISANDO ATENDER ÀS NECESSIDADES DO HEMOAP"
25001588,"1º ADITIVO DE PRAZO E VALOR, PARA CONTRATAÇÃO DE EMPRESA ESPECIALIZADA EM LOCAÇÃO DE VEÍCULOS TIPOS VAN"
25001589,"Contratação de serviço especializado para a realização de evento voltado à promoção da Economia Criativa, com foco em jogos digitais."
25001590,Aquisição de Equipamentos de Informática para Modernização do Parque Tecnológico da Procuradoria-Geral do Estado do Amapá -PGE/AP.
25001591,Aquisição de Equipamentos de Informática para Modernização do Parque Tecnológico da Procuradoria-Geral do Estado do Amapá ? PGE/AP
25001592,"AQUISIÇÃO DE VIATURA DESCARACTERIZADA, TIPO SEDAN C1, VISANDO ATENDER NECESSIDADES DA POLÍCIA CIVIL DO ESTADO DO AMAPÁ"
25001593,"TERMO ADITIVO DE ACRESCIMO DE 25%, PARA CONTRATAÇÃO DE EMPRESA ESPECIALIZADA SERVIÇO GRÁFICO E SERIGRÁFICO "
25001594,"TERMO ADITIVO DE ACRESCIMO DE 25%, PARA CONTRATAÇÃO DE EMPRESA ESPECIALIZADA NA CONFECÇÃO DE MATERIAIS GRÁFICOS E SERIGRÁFICOS - MALHARIA"
25001595,25 (vinte e cinco) veículos utilitários tipo pick up
25001596,"Aquisição de SMART TV?S, para atender as demandas da Polícia Civil do Estado do Amapá."
25001597,Aquisição de Equipamentos de Informática para Modernização do Parque Tecnológico da Procuradoria-Geral do Estado do Amapá -PGE/AP
25001601,Aquisição de Insumos de Material de Construção.
25001602,Contratação de Empresa Especializada na Prestação de Serviços de Pesquisa e Comparação de Preços no sistema online do ?BANCO DE PREÇOS? .
25001603,AQUISIÇÃO DE 06 (SEIS) VEÍCULOS LEVES TIPO SEDAN - PROJETO AMAZÔNIA
25001604,CONSTRUÇÃO DA DELEGACIA DE POLÍCIA CIVIL DO MUNICÍPIO DE AMAPÁ-AP.
25001605,"CONTRATAÇÃO DE EMPRESA ESPECIALIZADA PARA CONSTRUÇÃO DA 2ª (SEGUNDA) ETAPA DE URBANIZAÇÃO DA ORLA DO ATURIÁ, NO MUNICÍPIO DE MACAPÁ/AP"
25001606,"PRIMEIRA REPACTUAÇÃODE EMPRESA ESPECIALIZADA EM PRESTAÇÃO DE SERVIÇOS TERCEIRIZADOS DE LIMPEZA - HIGIENIZAÇÃO, CONSERVAÇÃO. COM FORNECIMENTO DE TODOS OS MATERIAIS E EQUIPAMENTOS "
25001607,"Contratação de empresa especializada na prestação de serviços de telecomunicações necessários a implantação, operação, manutenção e monitoramento de rede IP MULTISERVIÇOS, com tecnologia MPLS, objetivando a interligação da Agencia de Defesa e Inspeção Agropecuária do Estado do Amapá/DIAGRO à Intranet do Governo do Estado do Amapá-GEA."
25001608,Contratação dos serviços de manutenção preventiva e corretiva dos condicionadores de ar para garantir a qualidade do ambiente nas instalações da Secretaria de Cultura do Estado do Amapá (SECULT) e suas vinculadas
25001609,"contratação de empresa especializada na prestação de serviços de controle de pragas, roedores, morcegos, aves"
25001612,"O objeto do presente instrumento é a prestação de serviço especializado em segurança da informação para execução sob demanda de testes de intrusão em infraestrutura de TIC, nas condições estabelecidas no termo de referência."
25001613,"Contratação de solução de videowall, composta por bens, serviços e acessórios"
25001614,"CONSTRUÇÃO DO CENTRO MULTIUSO CIDADE TUCUJU, NO MUNICÍPIO DE MACAPÁ/AP"
25001616,contratação dos serviços de empresa especializada na prestação de serviço inerentes à manutenção predial preventiva e corretiva dos bens imóveis da Defensoria Pública do Estado do Amapá - DPE/AP
25001617," O objeto desta contratação é a aquisição de suprimentos de informática (TONER) para atendimento das necessidades do Tribunal de Justiça do Amapá, nos termos e condições estabelecidas neste instrumento e no Termo de Referência."
25001618,Serviço de Buffet
25001620,"Contratação dos serviços de reestruturação dos espaços físicos destinados a reuniões estratégicas, treinamentos, eventos institucionais e atendimentos qualificados"
25001621,AQUISIÇÃO DE CENTRAIS DE AR.
25001622,"CREDENCIAMENTO DE EMPRESAS DE ARQUITETURA E ENGENHARIA PARA A ELABORAÇÃO DE ESTUDOS PRELIMINARES, ANTEPROJETOS, PROJETOS BÁSICOS, EXECUTIVOS, ESTUDOS E LEVANTAMENTOS TÉCNICOS"
25001623,"O objeto do presente instrumento é a aquisição de suprimentos de informática (TONER para IMPRESSORA HP multifuncional Color LaserJet Pro M479FDW, AMARELO), nos termos das condições estabelecidas neste instrumento e no termo de referência."
25001624,AQUISIÇÃO DE VEÍCULO UTILITÁRIO TIPO PICK-UP VISANDO ATENDER NECESSIDADES DA POLÍCIA MILITAR DO ESTADO DO AMAPÁ
25001626,"Aquisição de material de consumo específico, qual seja, Café torrado e moído, tipo tradicional, suave, empacotamento a vácuo, pacote de 250 gramas, da marca PURO."
25001627,"O objeto do presente instrumento é a prestação de serviços técnicos especializados de pesquisa e aconselhamento imparcial em Tecnologia da Informação e Comunicações (TIC), nos termos das condições estabelecidas neste instrumento, no termo de referência e na proposta da contratada."
25001629,"AQUISIÇÃO DE VEÍCULOS, COM OBJETIVO DE MODERNIZAR E PRESTAR APOIO LOGÍSTICOS NAS AÇÕES DE ATER/PAA INÍGENA."
25001630,"CONTRATO DE PATROCINIO PARA O PROJETO "" FESTIVAL JOGATÓRIO - 3ª EDIÇÃO"""
25001631,contratação de Link de Internet Redundante para atender às necessidades da Defensoria Pública do Estado do Amapá ? DPE/AP.
25001632, CONTRATAÇÃO DE EMPRESA ESPECIALIZADA NO FORNECIMENTO DA LICENÇA DO SITE BANCO DE PREÇOS A FIM DE ATENDER ÀS NECESSIDADES DO HEMOAP
25001633,AQUISIÇÃO DE VEÍCULOS PARA ATENDER AOS SETORES PSICOSOCIAIS DA POLÍCIA CIVIL DO ESTADO DO AMAPÁ E O FUNDO ESTADUAL DE SEGURANÇA PÚBLICA DO AMAPÁ
25001634,"O objeto do presente instrumento é a contratação de empresa especializada para a prestação de serviços técnicos de consultoria ambiental, consistentes na elaboração do Inventário de Emissões de Gases de Efeito Estufa (GEE) do Tribunal de Justiça do Estado do Amapá (TJAP), nos termos das condições estabelecidas neste instrumento e no termo de referência."
25001635,AQUISIÇÃO DE CERTIFICADO DIGITAL SSL WILDCARD OV ? 24 MESES.
25001637,"AQUISIÇÃO DE VEÍCULOS, EM CUMPRIMENTO À META DO CONVENIO 95136/2023."
25001638,"Contratação de serviços de levantamento, catalogação e elaboração de banco de dados digital das memórias do Macapá Hotel e da Residência Oficial do Governo do Amapá, e execução de exposição museológica no Parque Tecnológico Foz do Rio Amazonas e na Residência Oficial do Governo do Amapá"
25001639,"Contratação do INSTITUTO BRASILEIRO DE VALORIZAÇÃO E CAPACITAÇÃO ? IBVC, responsável pela organização da ?3ª Edição do Encontro Nacional da Valorização das Corregedorias Administrativas?, para atender as demandas da Corregedoria Geral da Polícia Civil do Estado do Amapá."
25001640,PAGAMENTO DE FATURAS DE ENERGIA DA CEA-EQUATORIAL 2025
25001641,JONAS ALVES FERNANDES - MEI
25001642,Aquisição de Equipamentos de Informática
25001643,5ª CORRIDA DO BPRE 2025
25001644,AQUISIÇÃO DE CENTRAIS DE AR PARA ESTRUTURAÇÃO DA SECRETARIA DE ESTADO DA JUSTIÇA E SEGURANÇA PÚBLICA SEJUSP
25001646,"CONTRATAÇÃO DO INSTITUTO NEGÓCIOS PÚBLICOS PARA REALIZAÇÃO DO CURSO DE FORMAÇÃO DE AGENTES DE CONTRATAÇÃO, PREGOEIROS E EQUIPE DE APOIO DE ACORDO COM A NOVA LEI DE LICITAÇÕES Nº 14.133/2021."
25001648,"CONTRATAÇÃO DE EMPRESA ESPECIALIZADA EM PRESTAÇÃO DE SERVIÇOS TÉCNICOS DE IMPLANTAÇÃO DE ESTRUTURAS EM CONCRETO, METÁLICA E MADEIRA, VISANDO ATENDER AS NECESSIDADES DA SECRETARIA DE ESTADO DA CULTURA"
25001649,"CONTRATAÇÃO DE EMPRESA ESPECIALIZADA EM PRESTAÇÃO DE SERVIÇOS TÉCNICOS DE IMPLANTAÇÃO DE ESTRUTURAS EM CONCRETO, METÁLICA E MADEIRA, VISANDO ATENDER AS NECESSIDADES DA SECRETARIA DE ESTADO DA CULTURA"
25001650,SERVIÇOS TÉCNICOS E ESPECIALIZADOS DE MANUTENÇÃO PREVENTIVA E CORRETIVA DE NATUREZA MECÂNICA E ELÉTRICA EM GRUPOS GERADORES DE ENERGIA
25001651,"Aquisição de bebedouros, frigobares e central de ar-condicionado"
25001652,Patrocínio do Projeto Juventude do Estado do Amapá no 60° Congresso da União Nacional dos Estudantes (CONUNE)
25001653,"CONSTRUÇÃO DO MERCADO POPULAR DO HABITACIONAL JARDIM AÇUCENA, NO MUNICÍPIO DE MACAPÁ/AP"
25001654,"AQUISIÇÃO DE WINDOWS SERVER 2022, PARA SERVIDORES DE RACK PARA SOLUÇÃO DE VIRTUALIZAÇÃO DE MÁQUINAS (VM)"
25001655,aquisição do veículo tipo ônibus
25001656,Aquisição de 40 (quarenta) centrais de ar visando atender as necessidades da Delegacia Geral de Polícia Civil do Estado do Amapá. 
25001657,Aquisição de centrais de ar visando atender as necessidades da Delegacia Geral de Polícia Civil do Estado do Amapá. 
25001658,PRIME CONSULTORIA E ASSESSORIA EMPRESSARIAL LTDA
25001659,Prestação de serviços de hospedagem e correlatos para atender às necessidades do MP-AP.
25001661,40 UND DE SOPRADORES
25001662,"Contratação de empresa especializada para o fornecimento de alimentos prontos tipo refeições Self Servisse (café da manhã, almoço/jantar, lanche e coffee break), visando atender as necessidades da Secretaria de Estado da Habitação ? SEHAB"
25001663,200 UND DE MOCHILAS COSTAIS FLEXIVEIS ANTI-INCÊNDIO
25001664,FORNECIMENTO DE AGUA E ESGOTO DE 2025
25001665,Aquisição de miras ópticas e magnificadores para atender as necessidades da Polícia Civil do Estado do Amapá.
25001666,"AQUISIÇÃO DE DUMBBELS 12KG, 18KG E 22KG PARA A ACADEMIA DE MUSCULAÇÃO"
25001667,"AQUISIÇÃO DE DUMBBELS 14KG, 16KG E 20KG PARA A ACADEMIA DE MUSCULAÇÃO"
25001668,"contratação de empresa concessionária para prestação e utilização dos serviços de distribuição e fornecimento de ENERGIA ELÉTRICA, conforme as condições estabelecidas no contrato de concessão pública e nas normas regulamentadoras da Agência Nacional de Energia Elétrica (ANEEL), visando atender às necessidades da DIAGRO, garantindo o fornecimento de energia elétrica necessária para o funcionamento das unidades administrativas, o atendimento aos servidores públicos, cidadãos ou usuários da administração pública"
25001669,"O presente Contrato tem por objeto a prestação do Serviço de Buffet, visando atender às necessidades desta Agencia de Defesa e Inspeção Agropécuária do Estado do Amapá"
25001670,AQUISIÇÃO DE ÁGUA MINERAL
25001671,AQUISIÇÃO DE MOBILIÁRIO
25001673,SERVIÇOS DE PUBLICAÇÃO NO DIÁRIO OFICIAL DA UNIÃO DE ATOS OFICIAIS E DEMAIS MATÉRIAS DE INTERESSE
25001674,AQUISIÇÃO DE FORNECIMENTO DE ACERVO BIBLIOGRÁFICO NACIONAL
25001675,Serviços gráficos e serigráficos.
25001676,"AQUISIÇÃO DE MOBILIÁRIOS DESTINADOS AO CIODES E IESP COM RECURSO FUNSEP, EIXO VPSP, REPASSE 2022, META 03, AÇÃO 06-AÇÃO ORÇAMENTÁRIA 2275-GND4."
25001677,"Aquisição de Água Mineral, visando atender as necessidades desta Agencia/DIAGRO"
25001678,"aquisição, sob demanda, de água mineral, natural, potável, de mesa, sem gás, acondicionada em garrafões de 20 litros e em garrafas descartáveis de 500ml"
25001679,O presente CONTRATO DE PATROCÍNIO tem por objeto o Patrocínio no evento denominado ?PROJETO: FEIRA INTERNACIONAL DE OIAPOQUE
25001681,AQUISIÇÃO DE VEÍCULOS
25001682,"Constitui objeto deste instrumento a contratação de link de internet redundante, nos termos das condições estabelecidas neste instrumento e no termo de referência."
25001683,"AQUISIÇÃO DE VEÍCULOS, EM CUMPRIMENTO À META DO CONVENIO 969293/2024/MDA"
25001684,"Aquisição de gêneros alimentícios não perecíveis, visando atender as necessidades desta Agencia/DIAGRO"
25001685,AQUISIÇÃO DE MATERIAL DECONSUMO - LEITE ARTIFICIAL NA FORMULA INFANTIL E SUPLEMENTO ALIMENTAR ADULTO
25001686,"Aquisição de monitores de vídeo de 23.8 polegadas, para atender as demandas da Polícia Civil do Estado do Amapá."
25001687,"o registro de preços para a futura e eventual contratação de empresa especializada na prestação de serviços, sob demanda, de organização e execução de eventos e serviços correlatos, incluindo fornecimento de buffet, para atender as necessidades da Defensoria Pública do Estado do Amapá em toda a sua extensão (Sede Administrativa, Anexos I e II e núcleos regionais"
25001689,"CONTRATAÇÃO DE EMPRESA ESPECIALIZADA PARA REFORMA DO COMANDO GERAL DA POLÍCIA MILITAR, NO MUNICÍPIO DE MACAPÁ/AP"
25001690,"O objeto do presente instrumento é a contratação de serviços de fornecimento de refeições self - service (lanche), nos termos do ANEXO I e conforme as condições e exigências estabelecidas neste instrumento, no edital e anexos, bem como na proposta, a fim de atender a VARA DA INFÂNCIA E JUVENTUDE DA COMARCA DE SANTANA."
25001692,"PAGAMENTO PARA A CONTRATAÇÃO DE EMPRESA ESPECIALIZADA NA PRESTAÇÃO DE SERVIÇO DE INTERNET VIA FIBRA ÓPTICA COM LINKS DEDICADOS, VISANDO ATENDER A NECESSIDADE DO CIODES/SEJUSP."
25001693,Contrato da aquisição de Gêneros alimentícios não perecíveis - Café
25001695,Innovia Soluções Inteligentes Ltda
25001696,AQUISIÇÃO DE VEÍCULOS
25001698,R. DA SILVA CORREA LTDA
25001699,SINALRONDA SINALIZAÇÃO VIÁRIA E SERVIÇOS LTDA
25001700,"contratação de empresa especializada na área da construção civil para execução da obra de: Construção do Núcleo Regional da Defensoria Pública do Estado do Amapá-DPE/AP, no Município de Amapá/AP."
25001701,Patrocínio no evento denominado ?Expo Favela Innovation Amapá 2025
25001702,Contrato AQUISIÇÃO DE GÊNEROS ALIMENTÍCIOS NÃO PERECÍVEIS PARA SEINF (AÇÚCAR E LEITE)
25001703,Aquisição de gêneros alimentícios não perecíveis
25001704,"Concessão de patrocínio em favor do professor Artur Diego Ferreira do Nascimento para a aquisição de kits de robótica destinados à equipe amapaense que representará o Brasil na FIRA RoboWorld Cup, campeonato internacional de robótica que será realizado em agosto, na Coreia do Sul."
25001705,CONTRATAÇÃO DE EMPRESA PARA CESSÃO DE EQUIPAMENTOS EM REGIME DE COMODATO COM FORNECIMENTO E AQUISIÇÃO DE INSUMOS LABORATORIAIS PARA REALIZAÇÃO DE TESTES IMUNOHEMATOLÓGICOS DO INSTITUTO DE HEMATOLOGIA E HEMOTERAPIA DO AMAPÁ E À HEMORREDE DO ESTADO
25001706,USINA FOTOVOLTAICA
25001707,"CONTRATAÇÃO DE EMPRESA ESPECIALIZADA EM PRESTAÇÃO DE SERVIÇOS TÉCNICOS DE IMPLANTAÇÃO DE ESTRUTURAS EM CONCRETO, METÁLICA E MADEIRA, VISANDO ATENDER AS NECESSIDADES DA SECRETARIA DE ESTADO DA CULTURA"
25001708,"Constituí o OBJETO do presente 1º TERMO ADITIVO ao contrato Nº007/2024- DIAGROO que tem por objeto a Locação de Veículos Automotores, visando ao atendimento da logística de Transporte da Agencia de Defesa e Inspeção Agropecuária do Estado do Amapá-DIAGRO"
25001709,"Contratação de empresa especializada na prestação de serviços terceirizados, de forma indireta e contínua, mediante dedicação exclusiva de mão de obra, por meio de postos de trabalho de servente de asseio, conservação e limpeza, com fornecimento de saneantes, domissanitários, materiais e equipamentos necessários à plena execução dos serviços, destinados ao atendimento das necessidades da Secretaria de Estado da Habitação - SEHAB."
25001710,CONTRATAÇÃO DE EMPRESA PARA PRESTAÇÃO DE SERVIÇOS DE MANUTENÇÃO PREVENTIVA E CORRETIVA EM CÂMARA FRIA E CÂMARA REFRIGERADA PARA CONSERVAÇÃO DE IMUNOBIOLÓGICOS (VACINAS)
25001711,AQUISIÇÃO DE VEÍCULOS PARA ATENDER NECESSIDADES DO CONVENIO 969293/2024-MINISTÉRIO DESENVOLVIMENTO AGRÁRIO
25001713,Aquisição de Pistolas Calibre 9 X 19mm
25001714,contratação de empresa especializada na prestação de serviços de certificação digital padrão ICP-Brasil
25001715,"Patrocínio financeiro ao ""Projeto Pescando na Expofeira com Reis do Rio""."
25001716,1.1. LOCAÇÃO DE IMOVEL NO MUNICÍPIO DE AMAPÁ/AP PARA ATENDER AO FUNCIONAMENTO DA UNIDADE POLICIAL DO MUNICÍPIO.
25001718,O presente contrato tempor objeto a Contratação de Empresa Especializada na Prestação de Serviço de Manutenção e Conservação de Veículos Automotoes e outros.
25001719,"O presente contrato tem por objeto a Contratação de Empresa Especializada na Prestação de Serviços de Manutenção e Conservação de Veículos Automotores e outrps.,"
25001723,R & R SANTOS LTDA EPP
25001724,CONTRATAÇÃO DE EMPRESA ESPECIALIZADA PARA INSCRIÇÃO SERVIDORES DA SEJUSP/AP NO PROGRAMA DE CAPACITAÇÃO DE ORDENADORES DE DESPESAS 
25001725,"O objeto do presente instrumento é a aquisição de solução tecnológica de automação para geração de documentos licitatórios, denominada Gerador de Documentos Licitatórios Plus (GDL+), conforme condições e exigências estabelecidas neste contrato e no termo de referência."
25001726,AQUISIÇÃO DE CÂMERA FOTOGRÁFICA DIGITAL PARA POLÍCIA CIENTÍFICA DO AMAPÁ
25001727,1º CORRIDA EM HOMENAGEM AO DIA DOS PAIS - VITÓRIA DO JARI E ITAUBAL.
25001728,Link de Internet - Fibra Óptica - 500MB - Localidade - Macapá
25001729,CONTRATAÇÃO DO CURSO CHATGPT PARA POLICIAIS E AGENTES DA LEI
25001730, CONTRATAÇÃO DE EMPRESA ESPECIALIZADA NA PRESTAÇÃO DE SERVIÇOS DE DISPONIBILIDADE E ACESSO A FERRAMENTA BANCO DE PREÇOS
25001731,CONTRATAÇÃO DE EMPRESA PARA FORNECIMENTO DE COMBUSTÍVEL AERONÁUTICO VISANDO ATENDER NECESSIDADES DO GRUPO TÁTICO AÉREO TRANSPORTADO.
25001732,"Contratação de Prestador de Serviços para Execução de Construção Modular com Painéis Termoacústicos em Estrutura Metálica ou Mista, e Serviços Diversos, com Fornecimentos de Equipamentos, Peças, Materiais e Mão de Obra, visando atender as necessidades dos órgãos e entidades que integram a Administração Pública do Estado do Amapá"
25001733,Termo de Fomento com o Centro Amazônico de Ensino Profissionalizante para execução do Amapá Agro Summit
25001734,"Contratação de empresa especializada na prestação de serviço de Outsourcing de Impressão, visando atender às necessidades do Instituto de Hematologia e Hemoterapia do Amapá, conforme condições, especificações e quantitativos constantes neste instrumento"
25001736,Aquisição de computadores
25001737,contratação de empresa especializada na prestação de serviços de locação de veículos
25001738," AQUISIÇÃO DE EQUIPAMENTOS E MATERIAL PERMANENTE,(Mobiliário e Eletrodomésticos) com recursos provenientes do convenio nº 968521/2024-MS- TRANSFEREGOV, visando o Fortalecimento do Sistema único de Saúde, além para atender as necessidades do Instituto de Hematologia e Hemoterapia do Amapá ?HEMOAP- 05 UND- Ar Condicionado-: Tipo: SPLIT HI-WALL; Capacidade: 12.000 Btus,;"
25001739,"AQUISIÇÃO DE EQUIPAMENTOS E MATERIAL PERMANENTE,(Mobiliário e Eletrodomésticos) com recursos provenientes do convenio nº 968521/2024-MS- TRANSFEREGOV, visando o Fortalecimento do Sistema único de Saúde, além para atender as necessidades do Instituto de Hematologia e Hemoterapia do Amapá ?HEMOAPLote 02- 07 und -Televisor- Tipo: Smart TV LED; tamanho da tela: 43""; Lote 03- 07 und- Armário - Material: aço; Altura: 1,90 m; Largura: 1,00 m; Lote 04- 10 und- Arquivo - Uso: pasta suspensa; Material: chapa de aço 24; Gaveta: 4 gavetas com corrediças telescópicas; Lote 06- 31 und- MESA - Material estrutura: MDF; Tipo: mesa para computador; "
25001740,"O presente Contrato tem por objetivo a prestação de serviços de OFICINAS DE CAPACITAÇÃO EM ENGENHARIA DE CUSTOS E ENGENHARIA DE ACOMPANHAMENTO TÉCNICO, no âmbito do produto ?CAIXA Políticas Públicas?, conforme detalhado nos ?Anexo I ? Detalhamento dos Serviços? e ?Anexo II ? Detalhamento dos Preços?, sendo esses anexos integrantes deste Contrato."
25001741,CONTRATAÇÃO DE EMPRESA PELO CREDENCIAMENTO - REFORMA E AMPLIAÇÃO DO HOSPITAL ESTADUAL DE LARANJAL DO JARI E PRÉDIO DA NEFROLOGIA DO HOSPITAL ESTADUAL DE LARANJAL DO JARI.
25001742,"CONTRATAÇÃO DE EMPRESA ESPECIALIZADA PARA ELABORAÇÃO DE PROJETOS BÁSICOS E EXECUTIVOS DE ENGENHARIA, ARQUITETURA E URBANISMO. - AMPLIAÇÃO DO LACEN E AMPLIAÇÃO DO LAFRON."
25001743,CONTRATAÇÃO DO CURSO CRIMES CIBERNÉTICOS
25001744,Contratação de Empresa Especializada na Fabricação de Móveis Planejados Multiuso.
25001745,AQUISIÇÃO DE EQUIPAMENTOS DE TECNOLÓGIA DA INFORMAÇÃO PARA SEPLAN
25001746,AQUISIÇÃO DE HEMOGLOBINÔMETRO (HEMOCUE HB 301) PARA ATENDER ÀS NECESSIDADES DO HEMOAP
25001747,"AQUISIÇÃO DE MATERIAL DE EXPEDIENTE, VISANDO ATENDER ÀS NECESSIDADES DO HEMOAP"
25001748,"AQUISIÇÃO DE MATERIAL DE EXPEDIENTE, VISANDO ATENDER ÀS NECESSIDADES DO HEMOAP."
25001749,"Aquisição de Refrigerador - Tipo: geladeira; Frost Free,: 2 portas."
25001750,"aquisição de suprimento de impressora (CARTUCHO DE TONER, CARTUCHO DE TINTA, FITA RIBBON e FITA ROTULADORA)"
25001751,"aquisição de suprimento de impressora (CARTUCHO DE TONER, CARTUCHO DE TINTA, FITA RIBBON e FITA ROTULADORA)"
25001752,TERMO ADITIVO CONTRATO SERVIÇOS DE AGENCIAMENTO DE PASSAGENS AÉREAS
25001753,"contratação de empresa especializada no fornecimento de Água Mineral, tipo galão 20 litros, Gelo em sacos de 3Kg"
25001754,"O objeto do contrato é a contratação de consultoria para elaboração da Estratégia Estadual de Ciência, Tecnologia e Inovação (CT&I) do Amapá, conforme especificações e quantitativos estabelecidos no Termo de Referência"
25001755,"Contratação de empresa especializada para desenvolvimento e implementação de um sistema integrado e inovador de gestão de resíduos sólidos para a 54ª Expofeira do Amapá, com foco em sustentabilidade, tecnologia e educação ambiental, conforme especificações e quantitativos estabelecidos no Termo de Referência"
25001756,Contratação de empresa especializada para prestação de serviço de manutenção corretiva em embarcações que integram o patrimônio da Delegacia Geral de Polícia Civil do Amapá.
25001757,"A aquisição de computadores, notebooks e monitores"
25001758,Aquisição de gêneros alimentícios não perecíveis -Café
25001759,"O presente termo tem como objeto a Aquisição de Hemácias para Tipagem Sanguínea ABO Reversa, visando atender às necessidades do Instituto de Hematologia e Hemoterapia do Amapá - HEMOAP"
25001760,"AQUISIÇÃO DE CENTRAIS DE AR CONDICIONADO, VISANDO ATENDER ÀS NECESSIDADES DO INSTITUTO DE HEMATOLOGIA E HEMOTERAPIA DO AMAPÁ, Lote: 01- "
25001761,"AQUISIÇÃO DE CENTRAIS DE AR CONDICIONADO, VISANDO ATENDER ÀS NECESSIDADES DO INSTITUTO DE HEMATOLOGIA E HEMOTERAPIA DO AMAPÁ. Lotes: 02, 03, 04 e 05"
25001762,"AQUISIÇÃO DE CENTRAIS DE AR CONDICIONADO, VISANDO ATENDER ÀS NECESSIDADES DO INSTITUTO DE HEMATOLOGIA E HEMOTERAPIA DO AMAPÁ. Lote 06"
25001763,CONTRATAÇÃO DE PESSOA JÚRIDICA PARA FORNECIMENTO E INSTALAÇÃO DE PERSIANAS.
25001764,"AQUISIÇÃO DE PNEUS E BATERIAS, VISANDO ATENDER OS VEÍCULOS DO HEMOAP"
25001765,Contratação de empresa para fornecimento de licença do software de reconhecimento facial denominado ?CLEARVIEW? a fim de atender as necessidades da Polícia Civil do Amapá.
25001766,"contratação de empresa especializada na prestação de serviços de manutenção predial preventiva e corretiva dos bens imóveis da Defensoria Pública do Estado do Amapá - DPE/AP,"
25001767,"O objeto do presente instrumento é a aquisição de solução de infraestrutura para inteligência artificial, conforme condições e exigências estabelecidas neste contrato e no termo de referência."
25001768,"A CONTRATAÇÃO DE LICENÇA PARA ACESSO À PLATAFORMA DIGITAL DE LIVROS ""BIBLIOTECA VIRTUAL"", PARA ATENDER ÀS DEMANDAS E NECESSIDADES DA BIBLIOTECA ELCY LACERDA, VINCULADA À SECRETARIA DE CULTURA DO ESTADO DO AMAPÁ. "
25001769,AQUISIÇÃO DE UMA EMBARCAÇÃO TIPO LANCHA
25001770,COPA BRASIL DE KICKBOXING 2025
25001771,"CREDENCIAMENTO DE EMPRESAS DE ARQUITETURA E ENGENHARIA PARA A ELABORAÇÃO DE ESTUDOS PRELIMINARES, ANTEPROJETOS, PROJETOS BÁSICOS, EXECUTIVOS, ESTUDOS E LEVANTAMENTOS TÉCNICOS"
25001772,iandra sabatine estados unidos
25001774,AQUISIÇÃO DE 10 KITS DE EXTENSÃO DO EQUIPAMENTO EZ1
25001775,"contratação de empresa especializada na prestação de serviços de instalação, desinstalação, manutenção preventiva e corretiva de condicionadores de ar, com reposição de peças, componentes e acessórios, visando atender as necessidades da Defensoria Pública do Estado do Amapá,"
25001776,ALPHA MALHARIA LTDA
25001777,"CONTRATAÇÃO INTEGRADA DE EMPRESA ESPECIALIZADA PARA ELABORAÇÃO DE PROJETOS EXECUTIVOS E CONSTRUÇÃO DA 1ª ETAPA DO TERMINAL HIDROVIÁRIO, NO MUNICÍPIO DE MACAPÁ/AP"
25001778,AQUISIÇÃO DE FUZIS DE ASSALTO MULTICALIBRE
25001779,CONTRATAÇÃO DO CURSO AVANÇADO DE INTELIGÊNCIA E ORGANIZAÇÕES CRIMINOSAS
25001780,CONTRATAÇÃO DE EMPRESA ESPECIALIZADA PARA REALIZAÇÃO DE CURSOS E TREINAMENTOS DOS SERVIDORES DA SEGURANÇA PÚBLICA DO ESTADO DO AMAPÁ
25001782,"Manutenção preventiva, e corretiva com fornecimento de mão de obra de elevador"
25001783, - 
